{
  "chart_revision": "3781f8a5206c660485d0ef2a214663d104eaded5",
  "cluster_context": "gke_shivam-serverless_us-central1-a_resilience-gate",
  "collected_at": "2026-10-01T18:06:01Z",
  "evidence": {
    "files": [
      "stage/staging.yaml",
      "workload/application-deployment.yaml",
      "analysis/service-health.yaml",
      "gate/analysis-template.yaml",
      "workload/signer-deployment.yaml",
      "workload/loadgen-cronjob.yaml",
      "analysis/analysisrun-staging.01m3w93zc6ddewce35bzy8d2t4.5664b01.yaml",
      "gate/job-d4371b40-f8cb-4b93-a8eb-007f416aa0bb.chaos-verdict.1.yaml",
      "gate/pod-d4371b40-f8cb-4b93-a8eb-007f416aa0bb.chaos-verdict.1-456rz.yaml",
      "gate/pod-d4371b40-f8cb-4b93-a8eb-007f416aa0bb.chaos-verdict.1-456rz.log",
      "scorecards/postgres-pod-failure.json",
      "scorecards/redis-pod-failure.json",
      "scorecards/signer-pod-failure.json"
    ],
    "redactions": [
      "secret-data"
    ]
  },
  "gate_runner_image_digest": "sha256:129ae3323061fb76c2957662b5849873aebd0322d616795b3f698b2414453d20",
  "loadgen_image_digest": "sha256:1f40432b1cbe7234e977f96c362c9bc550a2d2b583d014dd8669fe40d3e9e755",
  "namespace": "url-shortener-staging",
  "release_image_digest": "sha256:a5beda836336de1677e27c3c2ff09a1ab27d9366040cd985c347d700de6f476b",
  "repository_revision": "f156b076ce090594529ffe735b9da561e6e9a2f8",
  "run_id": "20261001-staging-gate-b8cc5caa",
  "scenario": "chaos-gate",
  "schema_version": "1.0",
  "signer_image_digest": "sha256:3e4749d4e9aa7820a7d1b0ab5dfec522f8591552c466ec744038960ea2f077aa",
  "status": "pass"
}
